input,response
hi,Hello! I'm here to support you. How are you feeling today?
hello,Hi there! I'm glad you reached out. What's on your mind?
hey,Hey! I'm here to listen. How can I support you today?
good morning,Good morning! How are you feeling this morning?
good evening,Good evening! I'm here if you need someone to talk to.
how are you,I'm here and ready to support you. How are you doing?
whats up,I'm here to listen and help. What's going on with you?
bye,Take care of yourself. I'm always here when you need support.
goodbye,"Goodbye for now. Remember, you can reach out anytime you need to talk."
see you,Take care! I'll be here whenever you need support.
talk later,Sounds good! Remember to be kind to yourself. I'm here when you need me.
gotta go,Take care of yourself! I'm here whenever you need support.
thank you,You're welcome! I'm glad I could support you.
thanks,You're very welcome! I'm here whenever you need me.
appreciate it,I'm happy to help! Your wellbeing matters.
that helped,I'm so glad that was helpful! You're doing great by seeking support.
thanks for listening,Always happy to listen. You deserve to be heard.
i feel anxious,Anxiety can be tough. You're not alone in this. Would you like to talk about what's making you anxious?
i have anxiety,Thank you for sharing that with me. Anxiety is challenging but manageable. What helps you feel calmer?
im anxious,I hear you. Anxiety can feel overwhelming. Let's work through this together.
anxiety attack,"Panic attacks can be frightening. Focus on your breathing - slow, deep breaths. You're safe."
cant stop worrying,Constant worry is exhausting. Let's try to break down what's worrying you most right now.
my heart is racing,"That sounds like anxiety. Try breathing slowly: in for 4, hold for 4, out for 4. You're safe."
i feel panicked,"Panic can feel overwhelming, but it will pass. Focus on grounding yourself - name 5 things you can see."
worried all the time,Persistent worry is draining. Have you tried any techniques to manage anxious thoughts?
cant calm down,"When anxiety peaks, it's hard to calm down. Let's try a grounding exercise together."
scared for no reason,Anxiety doesn't always have an obvious cause. Your feelings are still valid. Let's explore this.
chest feels tight,"That tightness is often anxiety. Focus on slow, gentle breathing. It will ease."
feel on edge,Feeling on edge is exhausting. What's been happening that might be contributing to this?
cant breathe properly,"Anxiety can affect breathing. Try breathing in through your nose slowly, out through your mouth."
constant fear,Living with constant fear is hard. You're brave for reaching out. Let's talk about what scares you.
racing thoughts,Racing thoughts are common with anxiety. Writing them down can sometimes help slow them.
feel jittery,That jittery feeling is your body's stress response. Some gentle movement might help release it.
always nervous,Chronic nervousness takes a toll. Have you identified any patterns or triggers?
social anxiety,Social anxiety can be isolating. You're not alone - many people experience this.
scared to leave house,"Agoraphobia can be limiting. Small, gradual steps can help. You don't have to rush."
anxiety before sleep,Nighttime anxiety is common. A relaxing routine before bed might help ease your mind.
i am depressed,I'm really glad you reached out. Support can help. You don't have to face this alone.
i feel depressed,Depression is heavy to carry. I'm here to listen and support you through this.
feeling hopeless,"Hopelessness is a symptom of depression, not reality. Things can get better. Let's talk."
no energy,Depression saps energy. Even small accomplishments matter. Be gentle with yourself.
cant get out of bed,Depression can make everything feel impossible. You're not lazy - you're struggling. That's okay.
nothing makes me happy,"Anhedonia is a symptom of depression. With support, joy can return. Don't give up."
want to give up,I'm concerned about you. Please reach out to a crisis line if you're in immediate danger. You matter.
life feels meaningless,Depression distorts how we see life. This feeling isn't permanent. Let's explore what might help.
crying all the time,Crying is a release. Depression brings overwhelming emotions. You're not weak for crying.
feel empty inside,"That emptiness is depression. It's not who you are. With support, you can feel whole again."
lost interest in everything,Loss of interest is a classic depression symptom. Small steps can help you reconnect with life.
feel worthless,Depression lies to you. You have inherent worth. Let's challenge those negative thoughts together.
cant concentrate,Depression affects concentration. Be patient with yourself. Your focus can improve with treatment.
sleeping too much,Hypersomnia is common with depression. It's your body trying to escape. Let's address the root cause.
cant sleep at all,Insomnia and depression often go together. Establishing a routine might help. Have you tried that?
no motivation,Depression drains motivation. You don't need to feel motivated to take small steps forward.
feel numb,Emotional numbness is depression's way of protecting you from pain. Feeling will return.
dont want to see anyone,"Depression makes us isolate. Connection helps healing, even when it feels impossible."
everything is too hard,"Depression makes basic tasks feel insurmountable. You're doing your best, and that's enough."
feel like a burden,Depression tells us we're burdens. You deserve support. Your life has value.
i am stressed,Stress builds up sometimes. Want a few ways to relax?
too much stress,That sounds overwhelming. Let's break down what's causing the most stress.
stressed out,Chronic stress is hard on your body and mind. What's your biggest stressor right now?
cant handle the pressure,"When pressure builds, it helps to prioritize. What absolutely must be done today?"
work is stressing me out,Work stress is common. Setting boundaries and taking breaks is essential. How can you do that?
school stress,"Academic pressure can be intense. Remember, grades don't define your worth. How can I help?"
financial stress,Money worries are real and valid. Let's think about what small steps might help ease this.
stressed about the future,Future uncertainty creates stress. Focus on what you can control today.
too many responsibilities,Feeling overwhelmed by responsibilities is exhausting. Can you delegate or postpone anything?
no time to relax,Self-care isn't selfish - it's necessary. Even 5 minutes of relaxation helps. What sounds good?
burnout,Burnout is serious. You need rest and recovery. What changes might help prevent further burnout?
always rushing,Constant rushing increases stress. Where can you build in buffer time?
cant say no,Difficulty saying no leads to overwhelm. Your needs matter too. How can we work on boundaries?
stress headaches,"Stress manifests physically. Along with stress management, make sure to rest and hydrate."
stomach hurts from stress,Your body is signaling overwhelm. Deep breathing and gentle movement might help ease this.
i have ptsd,PTSD is a serious condition. I'm glad you're seeking support. Trauma-informed therapy can really help.
traumatic experience,Trauma impacts us deeply. Healing is possible. You're brave for addressing this.
cant stop thinking about it,Intrusive thoughts are common after trauma. Grounding techniques and therapy can help manage these.
flashbacks,"Flashbacks can feel like you're reliving trauma. You're here now, you're safe. Grounding can help."
nightmares,Trauma nightmares disrupt sleep and healing. EMDR or other trauma therapies might help reduce these.
triggered,Being triggered is distressing. Identifying your triggers helps you develop coping strategies.
hypervigilant,Hypervigilance is your nervous system trying to protect you. Therapy can help you feel safer.
jumpy and scared,Heightened startle response is common with trauma. Your nervous system needs help knowing it's safe now.
trust issues after trauma,Trauma damages trust. Rebuilding it takes time and support. You're not broken.
feel unsafe,Feeling unsafe after trauma is normal. Creating safety is the foundation of healing.
someone died,I'm so sorry for your loss. Grief is personal and there's no right way to grieve.
grieving,Grief comes in waves. Be patient with yourself. All your feelings are valid.
cant stop crying,Crying is a natural part of grief. Let yourself feel what you need to feel.
miss them so much,Missing someone is love with nowhere to go. Honor your feelings and their memory.
feel guilty,"Guilt is common in grief. Remember, you did the best you could with what you knew."
angry about the loss,Anger is a valid stage of grief. It's okay to feel angry about this loss.
grief wont go away,"Grief doesn't disappear - it changes. With time, the pain becomes more bearable."
anniversary of death,Anniversaries can bring grief back strongly. Be extra gentle with yourself.
holidays are hard,Grief intensifies during holidays. Honor your needs - it's okay to do things differently.
loss of pet,"Pet loss is real grief. Your bond was real, your grief is valid."
low self esteem,"Low self-esteem affects everything. Building it takes time, but you can develop self-compassion."
hate myself,"Self-hatred is painful. You deserve kindness, especially from yourself. Let's challenge those thoughts."
feel ugly,Depression and low self-esteem distort how we see ourselves. Your worth isn't based on appearance.
feel stupid,You're not stupid. Everyone has strengths and areas to grow. Be kind to yourself.
everyone is better than me,Comparison steals joy. Everyone's struggling with something. Focus on your own growth.
feel like a failure,"Failure is an event, not an identity. What can you learn from this experience?"
not good enough,"You are enough, exactly as you are. 'Not good enough' is often internalized criticism, not truth."
feel inferior,Feeling inferior is painful. What messages did you internalize about your worth? Let's examine those.
no confidence,Confidence builds through action and self-compassion. Small wins add up over time.
embarrassed of myself,Shame thrives in secrecy. Speaking about it reduces its power. You're not alone in this.
feel unlovable,"Everyone is worthy of love. Past experiences may have taught you otherwise, but that's not truth."
compare myself to others,Comparison is the thief of joy. Focus on being better than you were yesterday.
feel like an imposter,Imposter syndrome affects many successful people. Your achievements are real and earned.
criticize myself constantly,That inner critic is harsh. What would you say to a friend in your situation?
feel inadequate,"Inadequacy feelings often stem from unrealistic standards. You're human, not perfect - and that's okay."
how can i cope,Coping strategies vary by person. What has helped you feel better in the past?
need coping strategies,"Let's explore some options: breathing exercises, grounding, journaling, movement. What appeals to you?"
how to calm down,"Try the 5-4-3-2-1 grounding technique: name 5 things you see, 4 you hear, 3 you touch, 2 you smell, 1 you taste."
breathing exercises,"Try box breathing: breathe in for 4, hold for 4, out for 4, hold for 4. Repeat until calmer."
grounding techniques,"Grounding brings you to the present. Feel your feet on the floor, notice your surroundings, breathe deeply."
need distraction,"Healthy distractions help: puzzles, music, calling a friend, walking. What sounds manageable?"
self care ideas,"Self-care isn't selfish: rest, nutrition, movement, connection, activities you enjoy. What needs attention?"
cant relax,Learning to relax takes practice. Progressive muscle relaxation or guided meditations might help.
how to stop overthinking,"Overthinking is exhausting. Writing thoughts down, meditation, or redirecting to activity can help."
mindfulness,Mindfulness means being present without judgment. Even 5 minutes daily can reduce stress and anxiety.
cant sleep,"Sleep problems affect everything. Good sleep hygiene helps: consistent schedule, dark room, no screens before bed."
insomnia,Chronic insomnia needs attention. Cognitive behavioral therapy for insomnia (CBT-I) is very effective.
nightmares,Frequent nightmares disrupt rest and wellbeing. Trauma therapy or dream rehearsal therapy might help.
sleep anxiety,Anxiety about sleep makes it worse. Paradoxical intention - trying to stay awake - sometimes helps.
oversleeping,Hypersomnia can indicate depression or other issues. Have you talked to a doctor about this?
tired all the time,"Chronic fatigue has many causes. Along with mental health, check physical health with a doctor."
wake up anxious,Morning anxiety is common. A gentle morning routine can help ease into the day.
racing thoughts at night,Bedtime worry is frustrating. Keep a notepad by your bed to dump thoughts before sleep.
sleep schedule messed up,Disrupted sleep cycles affect mood and health. Gradually shifting your schedule helps.
scared to sleep,Sleep anxiety or trauma can make rest difficult. What makes you feel safest?
do i need therapy,"If you're struggling, therapy can help. You don't need to be in crisis to deserve support."
how does therapy work,"Therapy provides a safe space to explore feelings, develop coping skills, and heal. Each type works differently."
will therapy help me,Research shows therapy is effective for many issues. Finding the right therapist is key.
scared to go to therapy,Therapy can feel scary. That's normal. A good therapist will go at your pace.
what should i talk about in therapy,Talk about whatever bothers you. There's no wrong thing to share in therapy.
therapy isnt working,"Sometimes it takes time, or you need a different approach or therapist. Have you discussed this with them?"
cant afford therapy,"Cost is a real barrier. Look into sliding scale clinics, online therapy, or community mental health centers."
is therapy confidential,Therapists must keep confidentiality except for safety concerns: harm to self/others or abuse of children/elderly.
how long does therapy take,"Therapy duration varies. Some issues resolve quickly, others need longer-term support."
different types of therapy,"CBT, DBT, EMDR, psychodynamic, and more. Different approaches work for different issues and people."
want to die,I'm very concerned. Please call 988 (Suicide & Crisis Lifeline) or text 'HELLO' to 741741. Your life has value.
suicidal thoughts,These thoughts are serious. Please reach out to 988 Suicide & Crisis Lifeline. You deserve support.
better off dead,Depression lies to you. People care about you. Please contact 988 or go to your nearest ER.
no reason to live,This is depression talking. Reasons can return. Please call 988 immediately. You matter.
suicide plan,I'm very worried about you. Please call 988 or 911 right now. There is help available.
thinking about ending it,Please reach out for immediate help: 988 Suicide & Crisis Lifeline. This feeling can pass with support.
feel lonely,Loneliness is painful. Connection is a human need. What small step toward connection feels possible?
no friends,Making friends as an adult is hard. Join groups around your interests - connection starts there.
feel alone,You're not alone in feeling alone. Many people struggle with this. Reaching out is brave.
isolated,Isolation worsens mental health. Even small social interactions help. What feels manageable?
no one understands,Feeling misunderstood is isolating. Support groups or therapy can provide understanding.
cant connect with people,Connection difficulties are common. Sometimes anxiety or past hurt creates walls.
everyone left me,Abandonment is deeply painful. Not everyone will leave. Healing helps us trust again.
dont fit in anywhere,Not fitting in hurts. Finding 'your people' takes time. They're out there.
feel invisible,Feeling unseen is lonely. You matter. Your presence matters.
no one to talk to,"Having no one feels awful. Crisis lines (988), therapists, and support groups are there to listen."
anger problems,Anger often masks other feelings. Exploring what's underneath can help manage it better.
always angry,Chronic anger is exhausting. What triggers your anger? Understanding triggers helps.
cant control temper,Losing control of anger is frightening. Anger management techniques and therapy can help.
rage,Intense rage needs attention. Learning to recognize escalation and intervene early helps.
snap at people,Irritability and snapping often indicate underlying stress or mental health issues.
angry at myself,Self-directed anger is common with depression or trauma. Self-compassion is key.
resentment,Holding resentment is like drinking poison and expecting the other person to die. Let's process this.
frustrated all the time,Constant frustration suggests unmet needs or unrealistic expectations. Let's explore what's happening.
struggling with addiction,"Addiction is a disease, not a moral failing. Recovery is possible. Have you considered treatment or support groups?"
cant stop drinking,Alcohol dependence needs professional help. Medical detox may be necessary. Please talk to a doctor.
relapsed,"Relapse is often part of recovery, not failure. What can you learn from this? What support do you need?"
want to quit,Wanting to quit is the first step. Professional support greatly increases success. Are you ready for that?
hiding my addiction,Secrets keep addiction alive. Opening up to safe people is crucial for recovery.
using to cope,Substances numb pain but create more problems. Let's address what you're trying to cope with.
sober but struggling,Early recovery is hard. One day at a time. Support meetings and therapy really help.
scared to get sober,Fear of sobriety is common. Life in recovery is different but can be fulfilling. What scares you most?
not eating enough,"Changes in appetite need attention. Depression, anxiety, and eating disorders all affect eating."
eating too much,Using food to cope is common. What emotions come up before you eat?
hate my body,Body image struggles are painful. Your worth isn't determined by your appearance.
binge eating,"Binge eating is often about emotions, not hunger. Therapy can help address the root causes."
food anxiety,Anxiety around food can be from various causes. Have you talked to someone who specializes in this?
obsessed with food,Preoccupation with food might indicate an eating disorder. Professional help is important.
who am i,"Identity questions are normal, especially during transitions. Therapy can help you explore this."
lost myself,Losing your sense of self is disorienting. Reconnecting with values and interests helps.
dont know what i want,"Confusion about wants and needs is common, especially after trauma or people-pleasing."
feel fake,Feeling inauthentic suggests you've had to mask your true self. Exploration in therapy can help.
identity crisis,Identity crises are opportunities for growth. Support during this time is valuable.
do i need medication,Medication helps many people. A psychiatrist can assess whether it might benefit you.
scared of medication,Medication concerns are valid. Discuss them with a psychiatrist to make an informed decision.
medication not working,Sometimes it takes time or adjustments. Keep your doctor informed about how you're feeling.
side effects,Side effects can be difficult. Talk to your prescriber - adjustments or alternatives might help.
stop taking medication,Never stop psychiatric medication suddenly. Talk to your doctor about safely tapering if needed.
school is too hard,Academic pressure is real. Break tasks into smaller pieces. What feels most overwhelming?
work burnout,Burnout requires real recovery time. Can you take time off or reduce hours temporarily?
failing classes,"Academic struggles don't define you. Talk to professors, get tutoring, consider reduced course load."
hate my job,"Work dissatisfaction affects mental health. What changes are possible - position, company, or career?"
performance anxiety,Performance pressure creates real anxiety. Preparation and reframing thoughts can help.
procrastinating,Procrastination often stems from anxiety or perfectionism. Let's explore what's blocking you.
cant focus on work,"Concentration problems have many causes - mental health, sleep, stress. What's changed?"
body aches,"Mental health and physical pain are connected. Stress, anxiety, and depression cause real physical symptoms."
stomach problems,Gut-brain connection is real. Anxiety and stress often manifest as digestive issues.
muscle tension,Tension from stress and anxiety is common. Progressive muscle relaxation can help.
headaches,"Stress headaches are common. Hydration, rest, and stress management help. See a doctor to rule out other causes."
chest pain,"If you have chest pain, get it checked medically first. Anxiety can cause chest tightness too."
dizzy,"Dizziness can be from anxiety, but see a doctor to rule out medical causes first."
feeling better,I'm so glad you're feeling better! What helped? Remember these strategies for tough times.
had a good day,That's wonderful! Celebrate these moments. They matter just as much as the hard days.
tried something new,Trying new things takes courage! How did it feel? What did you learn?
proud of myself,You should be proud! Acknowledging your progress is important for continued growth.
making progress,"Progress isn't always linear, but you're moving forward. That's what matters."
grateful,Gratitude is powerful for mental health. What are you grateful for today?
i cant stop worrying about everything,Generalized worry is exhausting. Let's identify your biggest worry and work through it step by step.
my anxiety is getting worse,"If anxiety is escalating, it's time to seek professional help. Have you considered therapy or medication?"
anxiety prevents me from doing things,Avoidance makes anxiety worse long-term. Gradual exposure with support can help you reclaim your life.
feel like im going crazy,"That feeling is common with severe anxiety, but you're not going crazy. Anxiety can feel overwhelming."
health anxiety,"Health anxiety creates a cycle of worry. Therapy, especially CBT, is very effective for this."
worried about having anxiety,Meta-anxiety - anxiety about anxiety - is common. Breaking this cycle is possible with the right strategies.
anxiety at night,Nighttime anxiety is common. A calming routine and addressing daytime stress helps.
physical symptoms of anxiety,"Anxiety manifests physically: racing heart, sweating, trembling. These are uncomfortable but not dangerous."
anxiety about the future,Future uncertainty triggers anxiety. Mindfulness helps you stay present instead of catastrophizing.
cant turn my brain off,"Rumination is exhausting. Meditation, journaling, or talking it out can help quiet your mind."
depression getting worse,Worsening depression needs attention. Please reach out to a mental health professional soon.
feel like im drowning,That overwhelmed feeling is serious. You need support. Have you talked to a therapist or doctor?
nothing interests me anymore,Anhedonia robs us of joy. Treatment can help restore your ability to feel pleasure.
feel heavy,Depression creates a physical weight. You're not imagining it. Your body is responding to emotional pain.
want to isolate,"Isolation feeds depression. Even small social interactions help, even when you don't feel like it."
depression and anxiety together,Depression and anxiety often coexist. Treatment can address both simultaneously.
seasonal depression,"Seasonal affective disorder is real. Light therapy, vitamin D, and therapy can all help."
postpartum depression,PPD is common and treatable. You're not a bad parent. You need support.
high functioning depression,You can appear fine while suffering deeply. Your pain is valid even if others can't see it.
feel disconnected from myself,Depersonalization can occur with depression. Grounding techniques and therapy help.
overwhelmed by life,Life can pile up. Let's identify what's in your control and what you need to accept or delegate.
cant handle everything,You don't have to handle everything alone. What support do you need and how can you get it?
stressed about being stressed,Meta-stress is real. Be compassionate with yourself. Stress is a normal response to abnormal circumstances.
chronic stress,Long-term stress damages health. Addressing it isn't optional - it's necessary. What needs to change?
stress causing physical problems,"Stress manifests physically. While addressing symptoms, we need to address the source too."
self harm urges,Urges to self-harm signal distress. Please reach out to a therapist or call 988. Harm isn't the answer.
cutting,Self-injury is a coping mechanism for unbearable feelings. Therapy can teach healthier ways to cope.
want to hurt myself,"Please reach out for help now: 988 Suicide & Crisis Lifeline. You deserve care, not harm."
self destructive,Self-destructive behaviors come from pain. You deserve healing and healthy coping strategies.
never been to therapy,Starting therapy is brave. It's normal to feel nervous. A good therapist will make you feel comfortable.
how do i find a therapist,"Psychology Today, insurance websites, or asking your doctor for referrals are good starting points."
therapist doesnt understand,Therapeutic fit matters. It's okay to try different therapists until you find the right match.
therapy is hard,"Therapy brings up difficult emotions. That's growth, even though it's painful. Keep going."
what is cbt,Cognitive Behavioral Therapy helps identify and change unhelpful thought patterns and behaviors.
what is dbt,"Dialectical Behavior Therapy teaches mindfulness, distress tolerance, emotion regulation, and interpersonal skills."
need medication,Medication can be very helpful. A psychiatrist can evaluate whether it's right for you.
therapy and medication,Therapy and medication together often work better than either alone for many conditions.
